{
  "$schema": "../schemas/browser-file-result.schema.json",
  "schema_version": "webenvoy.browser-file-result/v1",
  "status": "completed",
  "dispatch_state": "dispatched",
  "operation": "file.download",
  "operation_ref": "managed-file-operation-1",
  "runtime_session_ref": "harbor:runtime-session/files",
  "profile_ref": "harbor:profile/files",
  "page_id": "page-id:files",
  "page_ref": "page:files",
  "document_generation": 1,
  "observation_ref": "observation:files",
  "target_ref": "target:download-link",
  "browser_delivery": "completed",
  "page_receipt": "observed",
  "page_processing": "unknown",
  "business_commit": "not_observed",
  "page": { "status": "ready", "origin": "https://files.example.test" },
  "download": {
    "file_ref": "attachment:runtime/11111111-1111-4111-8111-111111111111",
    "source": "browser_download",
    "status": "available",
    "display_name": "receipt.csv",
    "mime_type": "text/csv",
    "detected_mime_type": "text/csv",
    "byte_length": 12,
    "sha256": "aaaaaaaaaaaaaaaaaaaaaaaaaaaaaaaaaaaaaaaaaaaaaaaaaaaaaaaaaaaaaaaa",
    "created_at": "2026-09-13T00:00:00.000Z",
    "expires_at": "2026-09-20T00:00:00.000Z"
  },
  "download_event": {
    "page_url": "https://files.example.test/download",
    "url": "https://files.example.test/receipt.csv",
    "byte_length": 12,
    "sha256": "aaaaaaaaaaaaaaaaaaaaaaaaaaaaaaaaaaaaaaaaaaaaaaaaaaaaaaaaaaaaaaaa"
  }
}
